<?xml version="1.0" encoding="UTF-8"?>
<player_stats_templates xmlns:xsi="http://www.w3.org/2001/XMLSchema-instance" xsi:noNamespaceSchemaLocation="../stats.xsd">
	<!-- Checked By Kamui 10/2009 at US Retail -->
	<player_stats class="SCOUT" level="1">
		<stats_template maxHp="219" maxMp="170" evasion="105" block="105" parry="105" main_hand_attack="18" main_hand_accuracy="218" main_hand_crit_rate="3" magic_accuracy="14" crit_spell="50" strike_resist="90" spell_resist="50" power="100" health="100" agility="110" accuracy="110" knowledge="90" will="90" pve_attack="0" pve_defense="0" pvp_attack="0" pvp_defense="0">
			<speeds walk="1.5" run="6" fly="9" />
		</stats_template>
	</player_stats>
	<!-- Checked By Kamui 10/2009 at US Retail -->
	<player_stats class="SCOUT" level="2">
		<stats_template maxHp="261" maxMp="240" evasion="117" block="117" parry="117" main_hand_attack="18" main_hand_accuracy="226" main_hand_crit_rate="3" magic_accuracy="28" crit_spell="50" strike_resist="90" spell_resist="50" power="100" health="100" agility="110" accuracy="110" knowledge="90" will="90" pve_attack="0" pve_defense="0" pvp_attack="0" pvp_defense="0">
			<speeds walk="1.5" run="6" fly="9" />
		</stats_template>
	</player_stats>
	<!-- Checked By Kamui 10/2009 at US Retail -->
	<player_stats class="SCOUT" level="3">
		<stats_template maxHp="305" maxMp="310" evasion="130" block="130" parry="130" main_hand_attack="18" main_hand_accuracy="234" main_hand_crit_rate="3" magic_accuracy="42" crit_spell="50" strike_resist="90" spell_resist="50" power="100" health="100" agility="110" accuracy="110" knowledge="90" will="90" pve_attack="0" pve_defense="0" pvp_attack="0" pvp_defense="0">
			<speeds walk="1.5" run="6" fly="9" />
		</stats_template>
	</player_stats>
	<!-- Checked By Kamui 10/2009 at US Retail -->
	<player_stats class="SCOUT" level="4">
		<stats_template maxHp="351" maxMp="380" evasion="142" block="142" parry="142" main_hand_attack="18" main_hand_accuracy="242" main_hand_crit_rate="3" magic_accuracy="57" crit_spell="50" strike_resist="90" spell_resist="50" power="100" health="100" agility="110" accuracy="110" knowledge="90" will="90" pve_attack="0" pve_defense="0" pvp_attack="0" pvp_defense="0">
			<speeds walk="1.5" run="6" fly="9" />
		</stats_template>
	</player_stats>
	<!-- Checked By Kamui 10/2009 at US Retail -->
	<player_stats class="SCOUT" level="5">
		<stats_template maxHp="399" maxMp="450" evasion="155" block="155" parry="155" main_hand_attack="18" main_hand_accuracy="250" main_hand_crit_rate="3" magic_accuracy="71" crit_spell="50" strike_resist="90" spell_resist="50" power="100" health="100" agility="110" accuracy="110" knowledge="90" will="90" pve_attack="0" pve_defense="0" pvp_attack="0" pvp_defense="0">
			<speeds walk="1.5" run="6" fly="9" />
		</stats_template>
	</player_stats>
	<!-- Checked By Kamui 10/2009 at US Retail -->
	<player_stats class="SCOUT" level="6">
		<stats_template maxHp="449" maxMp="520" evasion="167" block="167" parry="167" main_hand_attack="18" main_hand_accuracy="258" main_hand_crit_rate="3" magic_accuracy="85" crit_spell="50" strike_resist="90" spell_resist="50" power="100" health="100" agility="110" accuracy="110" knowledge="90" will="90" pve_attack="0" pve_defense="0" pvp_attack="0" pvp_defense="0">
			<speeds walk="1.5" run="6" fly="9" />
		</stats_template>
	</player_stats>
	<!-- Checked By Kamui 10/2009 at US Retail -->
	<player_stats class="SCOUT" level="7">
		<stats_template maxHp="501" maxMp="590" evasion="179" block="179" parry="179" main_hand_attack="18" main_hand_accuracy="266" main_hand_crit_rate="3" magic_accuracy="99" crit_spell="50" strike_resist="90" spell_resist="50" power="100" health="100" agility="110" accuracy="110" knowledge="90" will="90" pve_attack="0" pve_defense="0" pvp_attack="0" pvp_defense="0">
			<speeds walk="1.5" run="6" fly="9" />
		</stats_template>
	</player_stats>
	<!-- Checked By Kamui 10/2009 at US Retail -->
	<player_stats class="SCOUT" level="8">
		<stats_template maxHp="555" maxMp="660" evasion="192" block="192" parry="192" main_hand_attack="18" main_hand_accuracy="274" main_hand_crit_rate="3" magic_accuracy="114" crit_spell="50" strike_resist="90" spell_resist="50" power="100" health="100" agility="110" accuracy="110" knowledge="90" will="90" pve_attack="0" pve_defense="0" pvp_attack="0" pvp_defense="0">
			<speeds walk="1.5" run="6" fly="9" />
		</stats_template>
	</player_stats>
	<!-- Checked By Kamui 10/2009 at US Retail -->
	<player_stats class="SCOUT" level="9">
		<stats_template maxHp="612" maxMp="730" evasion="204" block="204" parry="204" main_hand_attack="18" main_hand_accuracy="282" main_hand_crit_rate="3" magic_accuracy="128" crit_spell="50" strike_resist="90" spell_resist="50" power="100" health="100" agility="110" accuracy="110" knowledge="90" will="90" pve_attack="0" pve_defense="0" pvp_attack="0" pvp_defense="0">
			<speeds walk="1.5" run="6" fly="9" />
		</stats_template>
	</player_stats>
</player_stats_templates>